{
  "$schema": "https://json-schema.org/draft/2020-12/schema",
  "$id": "https://open-latent-interfaces.org/schemas/hybrid-graft-interface-v2.schema.json",
  "title": "Open Latent Interfaces Hybrid Graft Interface v2",
  "type": "object",
  "additionalProperties": false,
  "required": [
    "schema_version",
    "name",
    "model",
    "representation",
    "prompt_contract",
    "reader",
    "deterministic_mechanism",
    "writer",
    "evidence",
    "claim_boundary"
  ],
  "properties": {
    "schema_version": {"const": "oli.hybrid-graft-interface/v2"},
    "name": {"type": "string", "minLength": 1},
    "model": {
      "type": "object",
      "additionalProperties": false,
      "required": ["id", "revision"],
      "properties": {
        "id": {"type": "string", "minLength": 1},
        "revision": {"type": "string", "minLength": 1}
      }
    },
    "representation": {
      "type": "object",
      "additionalProperties": false,
      "required": ["residual_width"],
      "properties": {
        "residual_width": {"type": "integer", "minimum": 1}
      }
    },
    "prompt_contract": {
      "type": "object",
      "required": ["assistant_prefix", "locator", "output"]
    },
    "reader": {
      "type": "object",
      "additionalProperties": false,
      "required": ["hidden_state_index", "manifest"],
      "properties": {
        "hidden_state_index": {"type": "integer", "minimum": 1},
        "manifest": {"$ref": "#/$defs/fileReference"}
      }
    },
    "deterministic_mechanism": {
      "type": "object",
      "required": ["type", "operation", "input_contract", "output_contract"]
    },
    "writer": {
      "type": "object",
      "additionalProperties": false,
      "required": ["leading", "suffix"],
      "properties": {
        "leading": {
          "type": "object",
          "additionalProperties": false,
          "required": [
            "kind",
            "hidden_state_index",
            "desired_margin",
            "iterations",
            "norm_cap",
            "success_gate",
            "candidate_token_ids",
            "implementation"
          ],
          "properties": {
            "kind": {"const": "iterative_local_margin_compiler"},
            "hidden_state_index": {"type": "integer", "minimum": 1},
            "desired_margin": {"type": "number", "exclusiveMinimum": 0},
            "iterations": {"type": "integer", "minimum": 1},
            "norm_cap": {"type": "number", "exclusiveMinimum": 0},
            "success_gate": {"type": "string", "minLength": 1},
            "candidate_token_ids": {
              "type": "object",
              "required": ["0", "1", "2", "3", "4", "5", "6", "7", "8", "9"],
              "additionalProperties": {"type": "integer", "minimum": 0}
            },
            "implementation": {"$ref": "#/$defs/fileReference"}
          }
        },
        "suffix": {
          "type": "object",
          "additionalProperties": false,
          "required": [
            "kind",
            "hidden_state_index",
            "norm_cap",
            "basis",
            "positions"
          ],
          "properties": {
            "kind": {"const": "native_coordinate_prototypes"},
            "hidden_state_index": {"type": "integer", "minimum": 1},
            "norm_cap": {"type": "number", "exclusiveMinimum": 0},
            "basis": {"$ref": "#/$defs/fileReference"},
            "positions": {
              "type": "object",
              "additionalProperties": false,
              "required": ["1", "2"],
              "properties": {
                "1": {"$ref": "#/$defs/suffixPosition"},
                "2": {"$ref": "#/$defs/suffixPosition"}
              }
            }
          }
        }
      }
    },
    "evidence": {
      "type": "object",
      "additionalProperties": false,
      "required": [
        "audit_runs",
        "minimum_audit_exact_accuracy",
        "minimum_audit_reader_pair_accuracy",
        "minimum_shuffled_target_accuracy",
        "minimum_shuffled_target_advantage_over_random",
        "sources"
      ],
      "properties": {
        "audit_runs": {"const": 1},
        "minimum_audit_exact_accuracy": {"$ref": "#/$defs/rate"},
        "minimum_audit_reader_pair_accuracy": {"$ref": "#/$defs/rate"},
        "minimum_shuffled_target_accuracy": {"$ref": "#/$defs/rate"},
        "minimum_shuffled_target_advantage_over_random": {
          "$ref": "#/$defs/rate"
        },
        "sources": {
          "type": "object",
          "required": [
            "dataset_config",
            "compiler_selection_result",
            "development_config",
            "development_result",
            "audit_config",
            "audit_result"
          ],
          "additionalProperties": {"$ref": "#/$defs/fileReference"}
        }
      }
    },
    "claim_boundary": {
      "type": "array",
      "minItems": 1,
      "items": {"type": "string", "minLength": 1}
    }
  },
  "$defs": {
    "rate": {
      "type": "number",
      "minimum": 0,
      "maximum": 1
    },
    "fileReference": {
      "type": "object",
      "required": ["path", "sha256"],
      "properties": {
        "path": {"type": "string", "minLength": 1},
        "sha256": {"type": "string", "pattern": "^[0-9a-f]{64}$"},
        "key": {"type": "string", "minLength": 1},
        "url": {"type": "string", "format": "uri"}
      }
    },
    "suffixPosition": {
      "type": "object",
      "additionalProperties": false,
      "required": ["rank", "scale", "norm_cap", "prototypes"],
      "properties": {
        "rank": {"type": "integer", "minimum": 1},
        "scale": {"type": "number", "exclusiveMinimum": 0},
        "norm_cap": {"type": "number", "exclusiveMinimum": 0},
        "prototypes": {"$ref": "#/$defs/fileReference"}
      }
    }
  }
}
